此段落最初的2-5句話,此段落最末的2-5句話,段落大意
車行轔轔，日夜不停。玄難、鄧百川、康廣陵等均是當世武林大豪，這時武功全失，成為隨人擺佈的囚徒。 , 丁春秋拆開看了，冷笑道：「很好，很好。你還沒死心，要再決生死，自當奉陪。」便做了個手勢。,玄難、鄧百川、康廣陵等人被丁春秋帶上山，在涼亭，有青年漢子遞信給丁春秋。 
 那青年漢子從懷中取出一個炮仗，打火點燃。砰的一聲，炮仗躥上天空。, 丁春秋大袖飄飄，率先而行。他奔行並不急遽，但在這陡峭的山道上宛如禦風飄浮，足不點地，頃刻間便沒入了前面竹林。, 青年漢子取出炮仗施放，馮阿三認出那是他們門下的產物。之後用附有繩網的竹子扛他們上去。
 鄧百川等中了他化功大法的劇毒，一直心中憤懣，均覺誤為妖邪所傷，非戰之罪，,, 包大同調侃星宿派愛吹捧又厚臉皮，結果他們聽了卻點點頭，包不同就趁機跟他一搭一唱起來，心裡卻是看他們笑話。
說話之間，一行人已進了一個山谷。谷中都是松樹，山風過去，松聲若濤。, 突然之間，康廣陵、範百齡等函谷八友，一個個從繩網中掙扎下地，走到離那青石棋盤丈許之處，一齊跪下。, 一行人進入滿是松樹的山谷，見到段譽和一個老人在下棋，函谷八友走到石棋盤附近，一起跪下。
 包不同吃了一驚，說道：「搗什麼鬼？」四字一說出口，立即省悟，, 「此人雜務過多，書畫琴棋，無所不好，難怪武功要不及師弟。」, 原來眼前瘦小的老人正是聰辯先生，他正專心下棋，聽到少林寺玄難來，特別起身打招呼，隨後又回去下棋。
 萬籟無聲之中，段譽忽道：「好，便如此下！」說著將一枚白子下在棋盤之上。, 他跪在地下看不清楚，便即抬起膝蓋，伸長了脖子，想看個明白。, 聰辯先生贏了段譽，卻對他的棋藝給予肯定。段譽研究著如何破解「珍瓏」。
 蘇星河道：「你們大夥都起來！百齡，這個‘珍瓏’牽涉重大，你過來好好地瞧上一瞧，倘能破解得開，那是一件大大妙事。」, 但要殺卻旁邊一塊黑棋，牽涉卻又極多，再算得幾下，突然眼前一團漆黑，喉頭一甜，噴出一大口鮮血。,範百齡精研圍棋數十年，看著珍瓏想研究，發現牽涉很多 ，想著想著就吐血了。
 蘇星河冷冷地看著他，說道：「這局棋本來極難，你天資有限，雖棋力不弱，卻也多半解不開，, 丁春秋道：「妙極！你自毀誓言，是自己要尋死，須怪我不得。」,範百齡雖吐血還是堅持要繼續思考棋局。丁春秋在旁邊和蘇星河對話，對話中充滿火藥味。 
蘇星河走到大樹邊，提起樹旁一塊大石，放在玄難身畔，說道：「大師請坐。」, ，以致讓丁春秋橫行無忌，無人能加禁制，當真可歎。」, 蘇星河向玄難大師說明此珍瓏的來歷，玄難只覺得他們師徒都沒把心思放在練武，感到可惜。
 只聽蘇星河道：「我這個師弟，」說著向丁春秋一指，說道：「當年背叛師門，, 嗤嗤嗤三聲，三枚棋子彈出，打中了他胸口穴道，這才止了他噴血。, 蘇星河說丁春秋背叛師門，本來他想要一死殉師，但是為了這個棋局他才口延殘喘的活下來。
 眾人正錯愕間，忽聽得啪的一聲，半空中飛下白白的一粒東西，打上棋盤。,旁觀眾人心下欽佩，齊聲喝彩。 , 範百齡又再次吐血，蘇星河用棋子點他的穴道止血。此時有人暗地裡出棋子，落點準確，暗器功夫能力驚人。
彩聲未歇，只聽得松樹枝葉間傳出一個清朗的聲音：「慕容公子，你來破解珍瓏， , 腰懸長劍，飄然而來，面目清俊，瀟灑閒雅。, 藏在暗處下棋的人有兩個，一位是鳩摩智，另一位為是慕容公子。
 段譽一見之下，身上冷了半截，眼圈一紅，險些便要流下淚來，, 俊雅清貴的公子哥兒，當下互道仰慕，連丁春秋也說了幾句客氣話。, 段譽見王語嫣言神一直停留在慕容公子身上。慕容複和眾人行禮廝見。
 慕容複最後才和段譽相見，說道：「段兄，你好。」, 鄧百川等一齊搶上解救，但功力已失，全都慢了一步。, 慕容複與鳩摩智對奕，卻因鳩摩智的一句話拔刀自刎。
段譽食指點出，叫道：「不可如此！」 , 「哪一個大理段家的人在此？是段正淳嗎？」正是「惡貫滿盈」段延慶。, 段譽使出六脈神劍阻止慕容複自刎。從幻術中清醒的慕容複問段譽六脈神劍的事時，段延慶出現了。
 朱丹臣等立時變色。只聽得一個金屬相擦般的聲音叫道：「我們老大，才是正牌大理段氏，, 玄難贊道：「大理段氏武功獨步天南，真乃名下無虛。」, 段延慶、葉二娘、南海鱷神三人並肩而至要來跟聰辯先生下棋。
 段譽見過段延慶當日與黃眉僧弈棋的情景，知他不但內力深厚，, 氣憤憤地道：「不傷便不傷，打什麼緊！」又將虛竹放落。,換段延慶和蘇星河對奕，虛竹在旁邊插了一句話被南海鱷神提起來，因段譽的話又放落。 
眾人見這個如此橫蠻兇狠的南海鱷神居然聽段譽的話，對他以「徒兒」相稱也不反口，都感奇怪。 , 用正道是解不開的，但若純走偏鋒，卻也不行！」, 虛竹反省自己剛剛說過的話，段延慶下棋被玄難說走偏了，難以挽救。
段延慶左手鐵杖停在半空，微微發顫，始終點不下去，過了良久， ,此刻深悔入邪，自怨自責，自製之力減弱，隱伏在心底的自盡念頭又冒了上來。,這個珍瓏變幻百端，因人而施，愛財者因貪失誤，易怒者由憤壞事。段延慶下了下竟起了自盡的念頭。
 周圍的諸大高手之中，玄難慈悲為懷，有心出言驚醒，, 但第四股後勁卻沒有了，南海鱷神睜眼罵道：「你奶奶個雄！」放落了虛竹。, 周圍的高手，面對此況，有的是幸災樂禍，有的想出手相救就不知如何做，有的是看不出來。南海鱷神想丟出虛竹，以防止段延慶點自己的死穴，卻被丁春秋阻止了。
丁春秋發了這一掌，心力稍弛，段延慶的鐵杖停在半空，不再移動。 , 丁春秋向虛竹瞧了一眼，目中滿含怨毒之意，罵道：「小賊禿！」, 虛竹擅自加入棋局，閉眼亂放，被大家笑是胡來，段延慶卻從想要自盡的幻境中醒來。
 段延慶看了棋局變化，已知适才死裡逃生，乃出於虛竹的救援，好生感激，, 想到此節，霎時之間全身大汗淋漓。, 蘇星河堅持要虛竹繼續下棋，虛竹聽到有聲音指指示他如何下棋便照做，殊不知那人就是段延慶。因為虛竹亂下，棋局有了新的可能。
 段譽初時還關注棋局，到得後來，一雙眼睛又只放在王語嫣身上，, 白棋大勝，便解破了這個珍瓏棋局，拍手笑道：「好像成了吧？」, 段譽顧著看王語嫣，但是王語嫣還是只看慕容複，這時虛竹的白棋就要贏了。
 蘇星河滿臉笑容，拱手道：「小神僧天賦英才，可喜可賀。」, 以左掌消解了「控鶴功」，右掌連拍兩下，將他打了進去。, 虛竹解開了珍瓏，蘇星河請他進入沒有門戶的小木屋，虛竹用掌劈開門板。
 這兩掌力道剛猛，虛竹撞破一重板壁後，額頭砰的一下，又撞在一重板壁之上，只撞得昏天黑地，,繩子也是黑色，二黑相疊，繩子便看不出來，一眼瞧去，宛然是淩空而坐。, 虛竹進了屋聽見一個聲音說棋局是他布的，這個人還說他醜，懸吊在繩子上相是凌空一樣。
虛竹的相貌本來頗為醜陋，濃眉大眼，鼻孔上翻，雙耳招風，嘴唇甚厚， , 眼前這老者龍鍾不堪，看來沒一百二十歲，總也有一百歲。, 那人問起虛竹的名字，問起喬峰，又問破解棋局的事，便覺虛竹磕頭，虛竹也沒多想就嗑了，不知那就是在拜師，後來那人把自己的內壢灌入虛竹體內，自己反而衰老。
 那老人眯著雙眼，有氣沒力地一笑，說道：「大功告成了！,只道老前輩已給他害死了，原來老前輩尚在人世，那……那可好得很，好得很。」 , 虛竹得到那人的七十年功力，他要虛竹去殺了丁春秋。
 那老人歎了口氣，說道：「當年這逆徒勾結了我師妹，突然發難，, 說了兩個「你」字，突然間全身發抖，慢慢俯下身來，雙手撐在地下，似乎便要虛脫。, 老人向虛竹交代後要如何去尋找練功的方法，突然就全身發抖快要虛脫。
 虛竹吃了一驚，忙伸手扶住，道：「老……老前輩，你怎麼了？」, 砰的一聲，額頭撞在地下，就此不動了。, 老人給了虛竹自己的功力，所以逐漸衰弱，他無力地幫他戴寶石指環，說他事他的第三弟子，之後便倒地不動。
虛竹忙伸手扶起，一探他鼻息，已然氣絕，忙合十念佛 , 轉身從板壁破洞中鑽了出去，只輕輕一躍，便躥過兩道板壁，到了屋外。, 虛竹發現老人已經斷氣了，合掌念佛，離開木屋。
