此段落最初的2-5句話,此段落最末的2-5句話,段落大意
虛竹次日醒轉，發覺睡在一張溫軟的床上，睜眼向帳外看去，見是處身於一間極大的房中，,虛竹「啊」的一聲大叫，險些暈倒，重行臥倒，連呼：「糟糕，糟糕！」,虛竹酒醒後得知醉酒時所發生的事。
蘭劍、菊劍給他嚇了一跳，齊問：「主人，什麼事不對啦？」,虛竹嚇得不敢做聲，臉色慘白，心中亂跳，只好任由她四姊妹擺佈，再也不敢提一句不要她們服侍的話。,虛竹向部屬解釋沒有要責罰他們。
他料想段譽已經去遠，追趕不上，又想洞島群豪身上生死符未除，不能就此猝然離去，用過早點後，便到廳上和群豪相見，為兩個痛得最厲害之人拔除了生死符。,虛竹心想：「她們說石窟中有數百年前舊主人遺下的圖像，這些地道、石窟建構宏偉，少說也是數十年之功，且耗費人力物力極巨，當非靈鷲宮中這些婆婆姊姊們所能為，多半也是舊主人所遺下的了。」,虛竹與部屬為了更加了解生死符，前往靈鷲宮後殿石窟。
竹劍道：「這些奴才攻進宮來，鈞天部的姊姊們都給擒獲，我們四姊妹眼見抵敵不住，便逃到這裡躲避，只盼到得天黑，再設法去救人。」,看甲二時，果真是天山折梅手的第二招，依次看下去，天山折梅手圖解完後，便是天山六陽掌的圖解，童姥在西夏皇宮中所傳的各種歌訣奧秘，盡皆注在圓圈之中。,虛竹與部屬探索後殿石窟。
石壁上天山六陽掌之後的武功招數，虛竹就沒學過。,蘭劍道：「姥姥對我們期許很切，盼望我姊妹到了四十歲後，便能習練這上乘武功，可是……可是婢子們資質庸劣，便算再練二十三年，也未必敢再進這石室。」,虛竹部屬因功力不足無法練得石窟記載功法。
虛竹道：「原來如此，那卻是我的不是了，我不該要你們進去。」,五人從地道中出來，虛竹回入大廳，拔除了三人的生死符。,虛竹從石窟中返回大廳。
此後虛竹每日為群豪拔除生死符，一感精神疲乏，便到石室中去修習上乘武功。,虛竹拿起剃刀，將頭髮剃個清光，四姝無奈，只得與九部諸女一齊送到山下，灑淚而別。,虛竹治好群豪身上的生死符後，欲回少林寺。
虛竹換上了舊僧衣，邁開大步，東去嵩山。,慧輪起身擦了擦眼淚，說道：「你犯戒太多，我也沒法回護於你。你……你……自行到戒律院去領罪吧！這一下連我也有大大的不是。唉，這……」說著匆匆奔出。,虛竹向師父坦誠說明破戒情形。
虛竹來到戒律院前，躬身稟道：「弟子虛竹，違犯佛門戒律，恭懇掌律長老賜罰。」,虛竹恭恭敬敬地道：「是，多謝慈悲。」合十行禮，這才站起，心想：「不將我立即逐出寺門，看來事情還有指望。」心下甚慰。,虛竹至戒律院等候處罰。
他走到菜園子中，向管菜園的僧人道：「師兄，小僧虛竹犯了本門戒律，戒律院的師叔罰我來挑糞澆菜。」,虛竹低頭道：「小僧殺過人，而且殺了不止一人。」,虛竹向管菜園的緣根坦誠說明破戒情形。
緣根大吃一驚，臉色大變，退了三步，聽虛竹說殺過人，而且所殺的不止一人，登時心驚膽戰，生怕他狂性發作動粗，自己多半不是敵手，,如此一連數日，日間劈柴，晚上澆糞，苦受折磨，全身傷痕累累，也不知已吃了幾百鞭。,緣根對虛竹施加私刑。
這日早晨，虛竹正在劈柴，緣根走近身來，笑嘻嘻地道：「師兄你辛苦啦！」,緣根都說不是，並道：「師兄，我是不敢說的，只求你饒恕了我。他們說，我想要保全這雙眼珠子，只有求你親口答允饒恕。」說著偷眼向旁一瞥，滿臉都是懼色。,緣根向虛竹請求原諒。
虛竹順著他眼光瞧去，只見廊下坐著四名僧人，一色灰布僧袍、灰布僧帽，臉孔朝裡，瞧不見相貌。,虛竹道：「小僧是待罪之身，師兄如此客氣，叫小僧如何敢當？」站起身來，雙手去接茶壺。,緣根欲討好虛竹。
忽聽得鐘聲鏜鏜大響，連續不斷，是召集全寺僧眾的訊號。,玄慈說道：「六位大師都是佛門的有道大德。今日同時降臨，實為本寺重大光寵，故此召集大家出來見見。甚盼六位元大師開壇說法，宏揚佛義，合寺眾僧，同受教益。」,少林寺因有貴客到來而召集全寺僧人。
神山上人道：「不敢當！」他身形矮小，話聲竟然奇響，眾僧不由得都是一驚，,虛竹聽神山指摘少林弟子「良莠不齊，戒律廢弛」，當是指自己破犯葷戒、淫戒、殺戒等等而言，一顆心只嚇得怦怦大跳，心想方丈若坦言查究，自己必須直陳諸般罪行，絕不可推諉掩飾，又多犯了一項「妄語戒」。,神山上人指責少林寺不守戒律。
玄慈道：「請問師兄，何所據而云然？請師兄指出實證，敝派自當盡力追究整肅。」,說罷，雙目炯炯直視玄慈方丈，竟不少瞬。,神山上人舉證。
玄慈轉頭向戒律院首座玄寂大師道：「玄寂師弟，請你向六位高僧述說其中原由。」,玄寂師兄道：‘徐長老的兒子和媳婦，七月初三晚上服侍他老人家上床安息，到初四早晨，卻見徐長老肋骨齊斷，死在床上。」,少林寺說明自身查案經過，證明喬峰清白。
神山問道：「日子沒記錯麼？」玄寂道：「這件事至關要緊，我們是到徐長老家裡詳細問明瞭的。」,我們親眼目睹，殺單正的另有其人，早在喬峰到達單家莊之前兩個多時辰，單氏父子和他幾十個家人都早已給人殺了。至於去天臺山止觀寺保護智光大師，方丈師兄另行派得有人。我們見喬峰帶同阿朱向南方而去，便不再跟蹤，自行回寺。,少林寺提出不在場證明及武功特性，證明寺方清白。
玄寂、玄垢、玄石等僧在武林中數十年來威名素著，正直無私，眾所周知，他們既這麼說，神山等僧聽了絕無懷疑。,降魔掌和摩訶指，在敝寺均列於七十二絕技，一者輕柔，一者剛猛，極難並學齊練。玄生師弟，請你去藏經閣，將這兩門的法功心要取來，請神山上人和諸位大師指點。,少林寺以武功特性證明喬峰清白。
當年神山上人到少林寺求師，還只一十七歲。少林寺方丈靈門禪師和他接談之下，便覺他鋒芒太露，我慢貢高之氣極盛，器小易盈，不是傳法之人，,大雄寶殿和藏經閣相距幾達三裡，玄生在片刻間便將經書取到，輕功了得，身手敏捷之極。外人不知內情，也不以為異，少林寺眾僧卻無不暗自讚歎。,少林寺取出典籍證明自身說法。
那兩部經書紙質黃中發黑，顯是年代久遠。,本寺玄字輩師兄弟以及下一輩武功較高的僧侶，大都自羅漢拳學起，學到降魔掌或般若掌而止。老衲在四十歲上見獵心喜，學了大金剛拳，內力走了剛猛路子，自此練般若掌便生窒礙，至今好生後悔。,少林寺以實例證明清白。
突然外面一個清朗的聲音遠遠傳來，說道：「諸位高僧相聚少林寺講論武功，實乃盛事。小僧能否有緣做個不速之客，在旁恭聆雙方高見麼？」,旁人倒也沒什麼，神山卻暗自不忿：「你這番僧裝神弄鬼，未必便有什麼真實本領，待會倒要試你一試。」,鳩摩智來訪少林寺。
鳩摩智道：「小僧适才在山門外聽到玄慈大師講論武功，宏法高論，深受教益，只其中一節，小僧卻不敢苟同。」,他斜眼望著師父慧輪時，但見他淚水滾滾而下，實是傷心已極。他雖不明其中關節，但也知鳩摩智适才顯露的武功，本寺無人能敵，方丈無可奈何，只有自認不如。,鳩摩智展露自身功夫，打破少林寺絕技難以同時修習的認知。
可是他心中卻有一事大惑不解。眼見鳩摩智使出大金剛拳拳法、般若掌掌法、摩訶指指法，招數是對是錯，他沒學過這幾門功夫，自是無法知曉,但二十餘年來，他在寺中從未當眾說過一句話，在大殿中一片森嚴肅穆的氣象之下，話到口邊，不禁又縮了回去。,虛竹看出鳩摩智是以小無相功使出少林寺絕技。
只聽鳩摩智道：「方丈既如此說，那是自認貴派七十二門絕技，中間不免大有毛病，甚或根本並非貴派自創，這個‘絕’字，須得改一改了。」,只聽得波波波三響，指力相撞。玄渡大師身子一晃，突然間胸口射出三支血箭，激噴數尺，兩股指力較量之下，玄渡不敵，給鳩摩智三股指力都中在胸口，便如是利刃所傷。,鳩摩智踢館少林寺。
玄渡大師為人慈和，極得寺中小輩僧侶愛戴。,當日虛竹得段延慶指點，破解無崖子所布下的珍瓏棋局之時，鳩摩智曾見過他一面，此刻突然見他越眾而出，以輪指虛點，封閉玄渡的穴道，手法之妙，功力之強，竟為自己生平所未見，不由得大吃一驚。,虛竹救治玄渡。
慧方等六僧那日見虛竹發掌擊死玄難，又見他做了外道別派的掌門人，種種怪異之處，沒法索解，當即負了玄難屍身，回到少林寺中。,他是佛門中天下知名的高僧，所使的如何會不是佛門武功？,虛竹指出鳩摩智不會少林寺絕技。
鳩摩智心中卻又一驚：「這小和尚怎知我使的不是拈花指？不是佛門武功？」,虛竹這三下指力都彈在鐘上，便如以鐘槌用力撞擊一般。眾僧聽了，盡皆驚異。,虛竹示範鳩摩智的手法。
鳩摩智叫道：「好功夫！你試我一招般若掌！」說著雙掌一立，似是行禮，雙掌卻不合攏，呼的一聲，一股掌力從雙掌間疾吐而出，奔向虛竹，正是般若掌的「峽谷天風」。,虛竹道：「是！小僧告退。」合十行禮，退入虛字輩群僧的班次。,鳩摩智看出虛竹會小無相功。
玄慈方丈卻精明之極，雖不明白虛竹武功的由來，但看他適才所演的幾招，招數精奇，內功深厚，足可與鳩摩智相匹敵，,但他此刻身上既具逍遙派三大高手深厚內力，複得童姥盡心點撥，而靈鷲宮地下石窖中數十日面壁揣摩，更得益良多，雙掌一拜下，身上僧衣便即微微鼓起，真氣流轉，護住了全身。,玄慈方丈示意虛竹與鳩摩智過招。
