此段落最初的2-5句話,此段落最末的2-5句話,段落大意
游坦之見蕭峰等一行直向北去，始終不再回轉，才知自己不會死了,於是遊坦之到十二歲上，便不再學武，遊駒請了個宿儒教他讀書。,游坦之站了一會，確定蕭峯不會再回來，便拿起石灰包要離開，看到蕭峯落下的易筋經。
但他讀書也不肯用心，老是胡思亂想。,不知什麼時候，能再見到這臉色雪白、纖弱秀美的小姑娘。」,游坦之讀書也不太用心，文武都不行，父親死後心中所想便是找蕭峯報仇。一想到阿紫容貌，胸口竟莫名一熱。
他低了頭大步而行，不多時便越過了那羣喬峯放回的難民。,進城之時，遊坦之已全身是血，只盼快快死去，免得受這許多苦楚。,游坦之走了沒多久，竟又被契丹兵抓了回去，以為是蕭峯指使的，進城時他已傷痕累累。
三名契丹兵在城中又行了好幾裡地，將他拉入了一座大屋。,身子在空中飄飄蕩蕩，實在也無法思想。,契丹兵將他拉進一座大屋，拖著他在地上要放人鳶子，阿紫在一旁拍手叫好。
那美貌少女正是阿紫。她見游坦之暗算蕭峰，蕭峰卻饒了他不殺，心中不喜，,眾官兵齊聲答應，將滿身是血的遊坦之架了出去。,原來是阿紫叫人把他抓回來的，想要好好折磨他，親自去放人鳶，但因重傷初癒，手上一軟，將游坦之重重摔下，待玩得夠了，便要將游坦之架了出去。
游坦之醒過來時，一陣黴臭之氣直沖鼻端，睜開眼來，一團漆黑，什麼也瞧不見，,尋思：「想個什麼新鮮法兒來折磨他才好？」,次日游坦之又被帶去見阿紫，他看到阿紫的腳如花瓣般美，阿紫見到卻是個滿身血污的醜陋少年，又在想方法折磨他。
突然之間，遊坦之喉頭發出「呵呵」兩聲，也不知從哪裡來的一股力道,心中盤算：「想些什麼法子來折磨他才好？」,游坦之不知哪來的力氣，竟上前抱住阿紫的雙腳，又吻又咬，阿紫嚇壞了，契丹兵急忙將他拉走，狠狠打他，阿紫又在盤算要如何折磨游坦之。
阿紫一抬頭，見遊坦之目不轉瞬地瞧著自己，便問：「你瞧著我幹什麼？」,阿紫聽到他叫喊，笑眯眯地瞧著他背影，想著自己的聰明主意，越想越得意。,阿紫見游坦之一直看自己，問他為何，游坦之說她好看，阿紫暗自歡喜，並想出一個主意和那士兵說。
遊坦之又給架回地牢，拋在乾草堆上。,身上雖多受苦楚，卻可再見到她秀麗的容顏，臉上不禁帶了一絲苦澀的笑容。,游坦之被架回大牢，晚上有人來在他臉上東弄西弄，游坦之以為他們要把他弄死，但過了數日也沒事，後來他們又來，游坦之以為要去見阿紫而心喜。
三個契丹人帶著他走過幾條小巷，走進一間黑沉沉的大石屋。,五個人按手撳腳，遊坦之哪裡還能動得半分？,他們帶游坦之到一鐵匠處，游坦之看到鐵匠對著他比劃，便想到是要做面具給他，嚇得驚聲尖叫。
那鐵匠鉗起燒紅的面具，停了一陣，待其稍涼，大喝一聲，,這一切功夫，都是室裡隊長在阿紫授意之下幹的。,面具帶上後便暈了過去，醒來時面具已和臉密密吻合，拿都拿不下來，這一切都是阿紫命人做的。
阿紫每日向室裡查問，游坦之戴上面具後動靜如何，初時擔心他因此死了，未免掃興，後來知他已不會死，心下甚喜。,阿紫格格嬌笑，說道：「磕頭的聲音這麼好聽，我可從來沒聽見過，你再多磕幾個聽聽。」,阿紫見到游坦之這副模樣甚是歡喜，游坦之想服侍在阿紫身邊。
游坦之是聚賢莊的小莊主，在莊上一呼百諾，從小養尊處優，幾時受過這等折辱？,室裡答應，帶著他出去。,阿紫騙游坦之說是蕭峯要抓他回去砍成肉醬，她這樣做是救了他一命，游坦之心生感激。
過不多時，室裡又帶著遊坦之進來，已給他換上契丹人的衣衫。,室裡應道：「是！」便來拉遊坦之手臂。,游坦之清洗一番後又帶到阿紫這，阿紫為他取名鐵丑，並叫獅子和馴獅人進來，想看看鐵丑的面具是否堅固，鐵丑驚嚇。
遊坦之心想：「身入獅籠，哪裡還有命在，還不如聽姑娘的話，將鐵腦袋去試試運氣吧！」,遊坦之全身骨痛欲裂，蹣跚著走到籠邊，一咬牙，便將腦袋從鐵柵間探了進去。,鐵丑推三阻四惹得阿紫不悅，阿紫叫室里抽他三十鞭，並要他鞭打時邊說喜歡享受。
那雄獅乍見他如此上來挑釁，嚇了一跳，退開兩步，,遊坦之道：「姑娘是天仙下凡，天下第一美人，我……我……想天天見到你。」,鐵丑將頭伸進去，沒想到竟連獅子也咬不下，馴獅人大聲斥喝，鐵丑大怒，將其也一同放在獅子前，馴獅人死了，鐵丑贏了，阿紫大喜。鐵丑希望能帶在阿紫身邊。
這話無禮已極，以他此時處境，也實在大膽之極。,只道：「你休息一會兒！」站起身來，逕自走了。,此時蕭峯來了，見鐵丑恐懼異常，不去拆他的面具，阿紫覺得她身體好後蕭峯很少來看他她，心裡不快，蕭峯見她耍性子便離開了。
阿紫瞧著他背影，怔怔的只是想哭，一瞥眼見到遊坦之，滿腔怒火,好吧，你不喜歡給我打，不打你就是了。」,阿紫滿滿怒火，看到游坦之又要室里在抽他三十大鞭，游坦之不知他又犯了什麼錯。
遊坦之聽到「不打你就是了」這六個字，心中一凜,抬了下去吧！這個人不好玩！室裡，還有什麼別的玩意兒沒有？」,游坦之心想若不讓阿紫打，她又會想出更多刑罰來，便開心接受，阿紫看她喜歡便要室裡打足一百大鞭，游坦之打得都不求饒，阿紫覺得無趣。
這一場鞭打，遊坦之足足養了一個月傷，這才痊癒。,四人躍下馬來，在城門邊等候。,這次後鐵丑很久都沒見到阿紫，在城裡做苦力，過了兩個多月，聽到阿紫叫他，竟邁不開腳步，阿紫要他跟她去個地方。
阿紫縱馬慢慢前行，走出了七八裡地，越走越荒涼，,游坦之向甕中一看，只見昨日捕來的那條大蜈蚣正在迅速遊走。,兩人轉入陰森森的山谷，阿紫拿出神木王鼎燒香料並在旁邊等著，果有一蜈蚣鑽了 進去，阿紫連忙將頂裹得緊緊的，回到端福宮中，第二日又把鐵丑叫去。
阿紫取過預備在旁的一隻大公雞，投入瓦甕。,咬緊牙齒，閉上眼睛，右手慢慢伸入瓦甕。,阿紫用公雞血養了蜈蚣七日，七日後阿紫要鐵丑將手伸進去給蜈蚣吸血。
他手指一伸入甕中，中指指尖上便如針刺般忽然劇痛。,一眼也沒瞧向遊坦之，似乎此人便如那條死蜈蚣一般，再也沒什麼用處了。,鐵丑雖痛，卻不敢妄動，待吸完血後，阿紫用手掌接黑血運功，結束後匆匆離去。
游坦之悵望阿紫的背影，直到她影蹤不見，解開衣衫看時,這麼一來，姿勢已與圖中的僧人無異，透氣更加舒服了。,鐵丑全身奇癢難熬、跳上跳下，懷中的易筋經掉了出來，他的唾液滴在上面，竟顯現出僧人的圖形，他的動作與僧人相似，頓竟覺舒服透氣。
如此伏著，雙眼與那書更加接近，再向那僧人看去，見他身上畫了許多極小的紅色箭頭。,他呆了一陣，疲累已極，便躺在地下睡著了。,鐵丑一直重複僧人動作，覺得舒服，癢感已全無，但疲累至極，便睡著了。
第二日一早，阿紫匆匆進殿，見到他赤身露體、蜷曲在地的古怪模樣,遊坦之見了這等威勢，倒也不敢貿然上前。,隔日阿紫進來嚇了一大跳，看到鐵丑沒死，便又叫他一同去捕毒蟲數次，每次鐵丑都能成功化毒。一次引來蟒蛇，阿紫怕鼎被破壞，急忙叫鐵丑驅趕。
便在此時，忽覺得一陣寒風襲體，只見西北角上一條火線燒了過來,姑娘，姑娘，我找到了！」但阿紫早已去遠。,草叢中忽然有東西爬來，是一隻蠶蟲，阿紫驚喜其是毒中大王，要鐵丑一起去追，兩人尋了很久卻沒有尋到。
游坦之涉水而過，循著焦線追去，只見焦線直通向前面山坳。他鼓氣疾奔，山頭盡處，赫然是一座構築宏偉的大廟。,原來是個酒肉和尚。看來這條蠶兒是他所養，而且他極之寶愛，卻怎麼去盜了來？」,阿紫回去後，鐵丑循著焦線尋，來到寺中的菜園，聽到一位和尚在大聲斥罵，望去居然是在罵那隻大蠶。
正尋思間，忽聽得菜園彼端有人叫道：「慧淨，慧淨！」,片刻之間，葫蘆外便結了一層白霜。,那和尚被另一個中年和尚叫回去做晚課，鐵丑用葫蘆罐將蠶裝進去帶走。
